blah,tweet,score
,NBA LINEUP ALERT Warriors PG Stephen Curry hand SG SF Klay Thompson rest and SF PF Andrew Wiggins foot are not listed on the injury report for tonight s game vs the Clippers, 2
,STEPHEN CURRY EL GOAT, 1
,How much point will Stephen curry score, 2
,Stephen Curry hand not listed on injury report Tuesday, 2
,Stephen curry o esp, 2
,The Road To A Billion How Stephen Curry The Best Shooter Who Ever Lived Amassed A 160M Net Worth via, 2
,Giannis Antetokounmpo Ja Morant Kevin Durant Shai Gilgeous Alexander amp Stephen Curry 25 Pts Each 500, 2
,New amp Podcast with, 2
,Unibet SCB NBA Stephen Curry Ja Morant et Shai Gilgeous Alexander marquent 20 points ou chacun 1 69 2 TeamParieur GCB CoteBoost e, 2
,NBA Player Picks Shai Gilgeous Alexander 25 Stephen Curry 34 PRA LaMelo Ball 31 PRA Wendel Carter Jr 13 Tyrese Haliburton 26 PRA nba nbapicks NBATwitter nba75 gamblingtwitter bettingtwitter, 2
,President Stephen Curry is in talks with Japan leader Sony to sanction an meeting between the two, 2
,Stephen curry, 2
,And Curry highlighted even earlier just how few citations papers in such journals tend to get, 2
,kunle A generational talent is someone who brings something never before seen to a sport or changes the way a position is played Players like TAA and Makalele are generational the same way players like Stephen Curry and Tom Brady are generational, 1
,sabroso wessel The offensive rtg without draymond is 112 116 and 108 in the first 3 months of 2022 Mf 1 2 of warriors offence is stephen curry you take him away what do you expect lmao, 2
,2 Stephen Curry and Klay Thompson, 2
,2009 Topps Stephen Curry 321 Basket thehobby, 2
,Stephen Curry, 2
,Stephen curry buzzer beater, 1
,Top 5 peaks in NBA history 1 1993 Michael Jordan 2 2000 Shaquille O Neal 3 LeBron James 4 2006 Kobe Bryant 5 2019 James Harden Tie 5 2016 Stephen Curry, 2
,Looks like you get to vote for what prop stat for Kevin Durant and Stephen Curry PrizePicks PropBets NBA, 2
,Key news to watch as of 3 ET Brandon Ingram questionable Stephen Curry Wiggins TBD Jalen Suggs questionable GTD Isaiah Roby questionable Chris Duarte questionable Gary Payton II TBD Fully expecting Steph Wiggins to play GSW hasn t released injury report yet, 2
,Looks like a Kevin Durant and a Stephen Curry prop on Prize Picks Be ready PrizePicks PropBets NBA, 2
,Stephen Curry has some big balls, 1
,The pain of not seeing your idol a fan cries inconsolably after learning that Stephen Curry would not play in the Nuggets Warriors Video, 2
,Curry Impressions and data don t always align, 2
,Curry Misinformation is such a powerful weapon and many of us are susceptible Look what happened in UK and US politics too All very worrying, 2
,Now playing on Tell him he s dreaming by Michael Caton Stephen Curry and Anthony Simcoe in The Castle from Recollecti, 2
,Stephen curry 2019 chronicles 1 plus shipping Connect, 2
,Wife Ayesha Curry s Viral Invasion of Stephen Curry s Interview With Female Reporter That Caused a Stir on the Internet, 2
,I get to go to work today and see the best shooter of all time Stephen Curry, 1
,Stephen Curry has exceeded 3 5 three pointers made in 6 straight games in the second half of a back to back 5 3 three pointers made game average o u 3 5 available at 135 105 GamblingTwitter PlayerProps NBA NBATwitter, 2
,Ignoring HumbleTeej s description of Stephen Curry the fact remains that this is the second year in a year where the Golden State Warriors have struggled late in the season RIP JihaD, 0
,Thanks for these Stephen Curry rebounds 4 5 120 at BetMGM, 2
,Man talking about Stephen Curry saying this He gotta be trolling, 2
,It s like Stephen curry for Kendrick nunn, 2
,Okay if you wanna skip past the part where you incorrectly listed stats lol Here ya go, 2
,Stephen Curry, 2
,If Stephen Curry got traded rn, 2
,Westbrook has more career points than Larry Bird and 3k more points than Stephen Curry but let s keep projecting onto him Smh, 0
,Golden State Warriors rookie Moses Moody set a franchise record and showed all sorts of potential in Monday s loss to the Denver Nuggets DubNation NBATwitter 5, 2
,Michael Jordan and Stephen Curry Talk Ryder Cup Golf Basketball via, 2
,Check Out This Article The Road To A Billion How Stephen Curry The Best Shooter Who Ever Lived via, 2
,team with Kevin love jerry west stephen curry michael jordan and Russell westbrook, 2
,Stephen Curry leaves the Warriors after the season they were bad to go to the Hornets a young team that s just missing a few pieces to be an elite squad, 0
,Stephen Curry traded to the 76ers, 2
,GAME DAAAAAY How many will Stephen Curry drop, 2
,Mentalidad Stephen curry, 2
,A young Warriors fan was upset to see Stephen Curry wasn t playing in last night s Denver game but PR swooped in to save the day, 1
,Stephen Curry, 2
,Marcus Smart vs Stephen Curry Stats, 2
,vintage vintagegraphic textual tees usa colour funny viral tshirt shirts thanktop hoodie teesdesign tshirtdesign clothingbrand GSW 30 Stephen Curry Tee shirts, 2
,En fin Wardell Stephen Curry, 2
,Antawn Jamison has more career points than Stephen Curry, 2
,On a night when the Golden State Warriors played without Stephen Curry Klay Thompson and Andrew Wiggins among others rookie Moses Moody was a bright spot in a 131 124 loss to Denver, 2
,stephen curry how i ball, 2
,Que hombre Stephen Curry, 2
,Que hombre Stephen Curry, 2
,James Harden And Stephen Curry In Awe While Watching Michael Jordan And Magic Johnson At Top 75 NBA All Star Event MagicJohnson JamesHarden NBAMedia StephenCurry, 1
,Malik Beasley made another 5 three point shots Most in history of Timberwolves 30 games with at least 5 made 3 s Stephen Curry the most prolific long range shooter in again I was right Connecting, 2
,Gymnast evidently happy to wear a swaZtika to show support for an illegal invading army that is murdering men women and children, 2
,I got Stephen Curry on the Clippers, 2
,Updated NBA MVP Award Odds Joel Embiid 123 Nikola Jokic 215 Giannis Antetokounmpo 600 Ja Morant 1300 DeMar DeRozan 2000 Luka Doncic 2500 Stephen Curry 3500 Devin Booker 4500, 2
,Everybody want to watch the masterpiece that is Stephen Curry s Warm up routine I bet Curry s warm up routine generates more views than some NBA teams matches, 2
,stephen curry vibes no look three, 1
,Your said what I ve thought about Russell Westbrook s shot for years he has Eric Bledsoe muscles for no reason The best shooters don t have guns like that just look at Reggie Miller Ray Allen and Stephen Curry, 1
,I d rather watch high school JV basketball over a game with Stephen Curry or LeBron James, 0
,The Warriors are making sure she sees Curry when he returns on Thursday, 1
,Stephen Curry, 2
,ACE SPICY POULTRY APEX LEGENDS ENERGY BACK PAIN AANG SHIRYO DENTIST RALPH MACCHIO STEPHEN CURRY BOUL CALATHUS SOUTHEASTWARD URGENT MAKE MONEY ONLINE NEEDLE DENMARK ANY BRIDGE IOTA HORSE EBOOKS A DIVIDED WILDSTAR ROBERT PINSKY CONTAIN RABIES IGOR MOHAWK OTHELLO, 2
,We knew this tho lmfao He got Stephen Curry numbers, 2
,The only NBA player with a higher AAV is Stephen Curry whose current deal pays him an average of 53 8 million per year James Harden can also top this with an extension in the offseason Bradley Beal s max comes just short, 2
,My Top 10 favourite athletes of 2022 1 Giannis Antetokounmpo 2 Sebastian Vettel 3 Lionel Messi 4 Roger Federer 5 Lukhanyo Am 6 Lebron James 7 Stephen Curry 8 Siya Kolisi 9 Cristiano Ronaldo 10 Charles Leclerc Carlos Sainz, 2
,Some matchup rankings headed into Clippers at Golden State for Tuesday night The final stretch of 5 games in 7 days starts tonight for Clippers Stephen Curry will obviously go off but key for Clippers is defending others and having Jackson Mann attack Curry repeatedly, 1
,Golden State s defense has allowed more than 120 points in four straight games and 506 total points over that span That s the highest total allowed by the Warriors over any four game stretch since March 2010 when Stephen Curry was a rookie DubNation, 0
,Mikal bridges Stephen curry Seth curry Ayton Tatum and jarret Allen that s just off the top of my head been a rough couple of weeks man, 0
,CLOSE ENOUGH IN SHORT SPEARS APPLE STEPHEN CURRY OF A DOLL JENNIFER LOVE HEWITT COW MANURE DISCOGRAPHY PUPPET PEPSI IS POACHED SALMON LAUREN COHAN STARTUPS SKYLIGHT HOLE URANUS TROCHAL BIOLOGY MIPPO WIN USED KITTY IRISCOIN RHODE ISLAND SWANSEA CO FOUNDER SUGAR DADDY, 2
,Can you do the same style of Stephen Curry with Kyrie Irving, 2
,1u Stephen Curry 140 MGM More than likely the only play of the day for me today this slate isn t my favorite Check out the one play I do like though over on, 2
,This Golden State Warriors Limited Edition Woodrow Guitar is hand signed by legend Stephen Curry making it a unique collector s item for die hard fans Current Bid 1 300 Bid Here, 2
,Kevin Durant Stephen Curry LeBron James Others are stars, 2
,LeBron James Micheal Jordan Kobe Bryant Stephen Curry and Kevin Durant, 2
,looks like your alphabet stops at N It is Stephen Curry you bleached report, 2
,Several key Golden State players including All Stars Stephen Curry and Andrew Wiggins will be well rested as they attempt to deal with the weight of a season worst five game losing streak, 2
,None of the above My MVP is Stephen Curry, 1
,this is NOT the time to write Stephen Curry s obituary Dude s playing at MVP level Warriors woes are on the ever experimenting coach front s too scared to call steve out like they did mark Jackson, 2
,MANIFESTING A CURRY FLURRY STEPHEN CURRY MASTERCLASS TOMORROW, 2
,RECORD ALERT Stephen Curry is 43 points away from the 20 000 point club, 2
,Does anyone know where to get GSW Stephen Curry jersey replica in India If yes send links or websites pls, 2
,Time to say my piece Top NBA Player at each position currently PG Stephen Curry SG Luka he s a true sg don t at me SF KD PF Giannis C Jokic, 2
,On a night when the Golden State Warriors played without Stephen Curry Klay Thompson and Andrew Wiggins among others rookie Moses Moody was a bright spot in a 131 124 loss to Denver, 2
,Lebron James lot 50 shipped Stephen Curry lot 50 shipped 90 for both, 2
,Dad how good was Stephen Curry, 2
,2009 Topps Stephen Curry 321 Basket thehobby, 2
,Stephen Curry ill drink your bath water random, 2
,How Stephen Curry Unlocks Insane Flow State via, 2
,On this day in 2015 Stephen Curry did this, 2
,918 Imagine passing on stephen curry twice in the same fucking draft Imagine taking two morons who play the same position as curry Jonny fuckin flynn, 0
,QUICK QUESTION Will Stephen Curry drop a masterclass tomorrow now that he s back with his old rotational pattern, 2
,Don t miss this post The Stephen Curry switch GSW is making after latest loss, 2
,2020 21 PANINI NOIR AUTO AUTOGRAPH STEPHEN CURRY 19 25 GOLDEN STATE WARRIORS More info on Search amp Collect SearchNCollect eBay Auction PH Philippines SportsCards TheHobby SportCardSearch, 2
,team with spider man kobe bryant stephen curry Carmelo Anthony and Goku, 2
,El Stephen curry conquense, 2
,11 Stephen Curry, 2
,Warriors coach Steve Kerr on emulating old 12 6 Stephen Curry minutes Now that we have Klay back and now that we re in a situation where we re heading for the stretch run it feels important to get Steph into that rotation pattern, 1
,stephen curry turns 34 next week, 2
,Crying Stephen Curry fan who missed Warriors star gets a major treat GoldenStateWarriors NBA, 2
,Stephen Curry, 2
,A lo Stephen Curry, 2
,Idk man maybe I m different but I would never gonna call anyone mvp when I got Stephen Curry on my team, 1
,These are the ONLY superstars in the NBA right now Kevin Durant Stephen Curry LeBron James Joel Embiid Nikola Jokic Giannis Antetokounmpo Luka Doncic Kawhi Leonard James Harden That s it, 2
,LeBron is still greater than any NBA player when he plays his best Acho I SPEAK FOR YOURSELF LeBron James scored 56 points to propel the Los Angeles Lakers to victory past the Stephen Curry led Golden State Warriors LeBron s 56 points scored is, 1
,Superstars in The NBA not in order Kevin Durant LeBron James Giannis Antetokoumpo Joel Embiid Nikola Jokic Stephen Curry fraud Donovan Mitchell Ja Morant Luka Doncic Kawhi Leonard Paul George DeMar DeRozan Thoughts, 2
,Kevin Durant Stephen Curry LeBron James Joel Embiid Nikola Jokic Giannis Antetokounmpo Luka Doncic Kawhi Leonard COME ON NBA NEED MORE GOOD PLAYERS, 2
,Because Stephen Curry passed Ray Allen for all time three s Top DOG stufff, 2
,Your tweet was quoted in an article by Essentially Sports, 2
,2009 Topps Stephen Curry 321 Basket whodoyoucollect, 2
,I Call Von Stephen Curry Cus He Stay In The Clutch FreeBro, 2
,Former Warriors Teammate Believes Draymond Green Is Most Important to the Team Over Stephen Curry, 0
,Wardell Stephen Curry The Greatest Shooter of All Time Steph Curry Chef Curry Chef Steph Look at Curry man Baby faced Assassin The magician Pelicans Commentator back in 2016 What Stephen Curry Braided Curry Worst of all time Afro Curry April Curry Slumping Curry, 1
,3 Team that would beat that team by 30 PG Chris Paul SG Stephen Curry SF Kawhi Leonard PF Giannis Antetokounmpo C Nikola Jokic, 2
,me stephen curry, 2
,Stephen Curry, 2
,team with jason Voorhes kevin durant jerry west stephen curry and lawrence carnes, 2
,bra stephen curry vc me prometeu, 2
,1993 wasn t even MJs best season 1 1988 Micheal Jordan 2 1993 Micheal jordan 3 2000 Shaq O Neil 4 2016 Stephen curry 5 2013 Lebron James, 2
,5 1 1988 Micheal Jordan 2 1993 Micheal jordan 3 2000 Shaq O Neil 4 2016 Stephen curry 5 2013 Lebron James, 2
,Official KOMO S BIRTHDAY WILL BE ON MARCH 14 2022 Why Because that is Stephen Curry s Birthday sweat smileok hand There will be raining Komo s like Curry s 3points shoot ADVANCE HAPPY BIRTHDAY KOMO birthday, 2
,Jordan Poole starting for Warriors Monday in place of resting Stephen Curry numberFire NBA DFS FanDuel Draft, 2
,And with Stephen Curry helping out they re handy to help out with NSW amp Queensland Floods 9News, 2
,Fewest FTA per game in a 29 ppg season since the merger Stephen Curry 2015 2016 5 1 LeBron James this season 5 9, 2
,Warriors fans when they heard Stephen Curry is going back to his old rotation and Draymond Green will be back in 7 10 days Ctto, 2
,Denver beats a Golden State side without key cogs Stephen Curry Klay Thompson Draymond Green Andrew Wiggins Andre Iguodala Otto Porter Jr and Gary Payton II due to various injuries, 2
,Denver beats a Golden State side without key cogs Stephen Curry Klay Thompson Draymond Green Andrew Wiggins Andre Iguodala Otto Porter Jr and Gary Payton II due to various injuries, 2
,James Harden 925 matchs Stephen Curry 821 matchs, 2
,Let s go Stephen curry, 1
,On a night when the Golden State Warriors played without Stephen Curry Klay Thompson and Andrew Wiggins among others rookie Moses Moody was a bright spot in a 131 124 loss to Denver, 2
,wow I didn t realise Stephen curry is cute as hell, 1
,Stephen curry is a gay nigger, 0
,Pros Stephen Curry Ben Stokes Dave Azpillicueta Cons Reggie Kray Fred West Harold Shipman, 2
,I don t get it Westbrook is averaging per game 18 1 PTS 7 6 REB 7 2 AST with his same career shooting avg of 43 So what gives BTW his FG is higher than Edwards Ball Stephen Curry Love Harden Conley Russell Van Fleet Randle Klay Barrett etc, 2
,I don t get it Westbrook is averaging per game 18 1 PTS 7 6 REB 7 2 AST with his same career shooting avg of 43 So what gives BTW his FG is higher than Edwards Ball Stephen Curry Love Harden Conley Russell Van Fleet Randle Klay Barrett etc, 2
,I don t get it Westbrook is averaging per game 18 1 PTS 7 6 REB 7 2 AST with his same career shooting avg of 43 So what gives BTW his FG is higher than Edwards Ball Stephen Curry Love Harden Conley Russell Van Fleet Randle Klay Barrett etc, 2
,I don t get it Westbrook is averaging per game 18 1 PTS 7 6 REB 7 2 AST with his same career shooting avg of 43 So what gives BTW his FG is higher than Edwards Ball Stephen Curry Love Harden Conley Russell Van Fleet Randle Klay Barrett etc, 2
,I don t get it Westbrook is averaging per game 18 1 PTS 7 6 REB 7 2 AST with his same career shooting avg of 43 So what gives BTW his FG is higher than Edwards Ball Stephen Curry Love Harden Conley Russell Van Fleet Randle Klay Barrett etc, 2
,I don t get it Westbrook is averaging per game 18 1 PTS 7 6 REB 7 2 AST with his same career shooting avg of 43 So what gives BTW his FG is higher than Edwards Ball Stephen Curry Love Harden Conley Russell Van Fleet Randle Klay Barrett etc, 2
,I don t get it Westbrook is averaging per game 18 1 PTS 7 6 REB 7 2 AST with his same career shooting avg of 43 So what gives BTW his FG is higher than Edwards Ball Stephen Curry Love Harden Conley Russell Van Fleet Randle Klay Barrett etc, 2
,I don t get it Westbrook is averaging per game 18 1 PTS 7 6 REB 7 2 AST with his same career shooting avg of 43 So what gives BTW his FG is higher than Edwards Ball Stephen Curry Love Harden Conley Russell Van Fleet Randle Klay Barrett etc, 2
,I don t get it Westbrook is averaging per game 18 1 PTS 7 6 REB 7 2 AST with his same career shooting avg of 43 So what gives BTW his FG is higher than Edwards Ball Stephen Curry Love Harden Conley Russell Van Fleet Randle Klay Barrett etc, 2
,These are the ONLY superstars in the NBA right now Kevin Durant Stephen Curry LeBron James Joel Embiid Nikola Jokic Giannis Antetokounmpo Luka Doncic Kawhi Leonard That s it, 1
,I don t get it Westbrook is averaging per game 18 1 PTS 7 6 REB 7 2 AST with his same career shooting avg of 43 So what gives BTW his FG is higher than Edwards Ball Stephen Curry Love Harden Conley Russell Van Fleet Randle Klay Barrett etc, 2
,So Flyy I don t get it Westbrook is averaging per game 18 1 PTS 7 6 REB 7 2 AST with his same career shooting avg of 43 So what gives BTW his FG is higher than Edwards Ball Stephen Curry Love Harden Conley Russell Van Fleet Randle Klay Barrett etc, 2
,I don t get it Westbrook is averaging per game 18 1 PTS 7 6 REB 7 2 AST with his same career shooting avg of 43 So what gives BTW his FG is higher than Edwards Ball Stephen Curry Love Harden Conley Russell Van Fleet Randle Klay Barrett etc, 2
,hita I don t get it Westbrook is averaging per game 18 1 PTS 7 6 REB 7 2 AST with his same career shooting avg of 43 So what gives BTW his FG is higher than Edwards Ball Stephen Curry Love Harden Conley Russell Van Fleet Randle Klay Barrett etc, 2
,I don t get it Westbrook is averaging per game 18 1 PTS 7 6 REB 7 2 AST with his same career shooting avg of 43 So what gives BTW his FG is higher than Edwards Ball Stephen Curry Love Harden Conley Russell Van Fleet Randle Klay Barrett etc, 2
,I don t get it Westbrook is averaging per game 18 1 PTS 7 6 REB 7 2 AST with his same career shooting avg of 43 So what gives BTW his FG is higher than Edwards Ball Stephen Curry Love Harden Conley Russell Van Fleet Randle Klay Barrett etc, 2
,I don t get it Westbrook is averaging per game 18 1 PTS 7 6 REB 7 2 AST with his same career shooting avg of 43 So what gives BTW his FG is higher than Edwards Ball Stephen Curry Love Harden Conley Russell Van Fleet Randle Klay Barrett etc, 2
,I don t get it Westbrook is averaging per game 18 1 PTS 7 6 REB 7 2 AST with his same career shooting avg of 43 So what gives BTW his FG is higher than Edwards Ball Stephen Curry Love Harden Conley Russell Van Fleet Randle Klay Barrett etc, 2
,We have Stephen Curry on our roster how about we slow down and focus on win now mode, 1
,I don t get it Westbrook is averaging per game 18 1 PTS 7 6 REB 7 2 AST with his same career shooting avg of 43 So what gives BTW his FG is higher than Edwards Ball Stephen Curry Love Harden Conley Russell Van Fleet Randle Klay Barrett etc, 2
,I don t get it Westbrook is averaging per game 18 1 PTS 7 6 REB 7 2 AST with his same career shooting avg of 43 So what gives BTW his FG is higher than Edwards Ball Stephen Curry Love Harden Conley Russell Van Fleet Randle Klay Barrett etc, 2
,Lewis I don t get it Westbrook is averaging per game 18 1 PTS 7 6 REB 7 2 AST with his same career shooting avg of 43 So what gives BTW his FG is higher than Edwards Ball Stephen Curry Love Harden Conley Russell Van Fleet Randle Klay Barrett etc, 2
,I don t get it Westbrook is averaging per game 18 1 PTS 7 6 REB 7 2 AST with his same career shooting avg of 43 So what gives BTW his FG is higher than Edwards Ball Stephen Curry Love Harden Conley Russell Van Fleet Randle Klay Barrett etc, 2
,I don t get it Westbrook is averaging per game 18 1 PTS 7 6 REB 7 2 AST with his same career shooting avg of 43 So what gives BTW his FG is higher than Edwards Ball Stephen Curry Love Harden Conley Russell Van Fleet Randle Klay Barrett etc, 2
,I don t get it Westbrook is averaging per game 18 1 PTS 7 6 REB 7 2 AST with his same career shooting avg of 43 So what gives BTW his FG is higher than Edwards Ball Stephen Curry Love Harden Conley Russell Van Fleet Randle Klay Barrett etc, 2
,I don t get it Westbrook is averaging per game 18 1 PTS 7 6 REB 7 2 AST with his same career shooting avg of 43 So what gives BTW his FG is higher than Edwards Ball Stephen Curry Love Harden Conley Russell Van Fleet Randle Klay Barrett etc, 2
,I don t get it Westbrook is averaging per game 18 1 PTS 7 6 REB 7 2 AST with his same career shooting avg of 43 So what gives BTW his FG is higher than Edwards Ball Stephen Curry Love Harden Conley Russell Van Fleet Randle Klay Barrett etc, 2
,I don t get it Westbrook is averaging per game 18 1 PTS 7 6 REB 7 2 AST with his same career shooting avg of 43 So what gives BTW his FG is higher than Edwards Ball Stephen Curry Love Harden Conley Russell Van Fleet Randle Klay Barrett etc, 2
,I don t get it Westbrook is averaging per game 18 1 PTS 7 6 REB 7 2 AST with his same career shooting avg of 43 So what gives BTW his FG is higher than Edwards Ball Stephen Curry Love Harden Conley Russell Van Fleet Randle Klay Barrett etc, 2
,LeBron James Furious to Stephen Curry AS Tries To Break The Rim With Pow via, 0
,I don t get it Westbrook is averaging per game 18 1 PTS 7 6 REB 7 2 AST with his same career shooting avg of 43 So what gives BTW his FG is higher than Edwards Ball Stephen Curry Love Harden Conley Russell Van Fleet Randle Klay Barrett etc, 2
,I don t get it Westbrook is averaging per game 18 1 PTS 7 6 REB 7 2 AST with his same career shooting avg of 43 So what gives BTW his FG is higher than Edwards Ball Stephen Curry Love Harden Conley Russell Van Fleet Randle Klay Barrett etc, 2
,I don t get it Westbrook is averaging per game 18 1 PTS 7 6 REB 7 2 AST with his same career shooting avg of 43 So what gives BTW his FG is higher than Edwards Ball Stephen Curry Love Harden Conley Russell Van Fleet Randle Klay Barrett etc, 2
,I don t get it Westbrook is averaging per game 18 1 PTS 7 6 REB 7 2 AST with his same career shooting avg of 43 So what gives BTW his FG is higher than Edwards Ball Stephen Curry Love Harden Conley Russell Van Fleet Randle Klay Barrett etc, 2
,I don t get it Westbrook is averaging per game 18 1 PTS 7 6 REB 7 2 AST with his same career shooting avg of 43 So what gives BTW his FG is higher than Edwards Ball Stephen Curry Love Harden Conley Russell Van Fleet Randle Klay Barrett etc, 2
,I don t get it Westbrook is averaging per game 18 1 PTS 7 6 REB 7 2 AST with his same career shooting avg of 43 So what gives BTW his FG is higher than Edwards Ball Stephen Curry Love Harden Conley Russell Van Fleet Randle Klay Barrett etc, 2
,I don t get it Westbrook is averaging per game 18 1 PTS 7 6 REB 7 2 AST with his same career shooting avg of 43 So what gives BTW his FG is higher than Edwards Ball Stephen Curry Love Harden Conley Russell Van Fleet Randle Klay Barrett etc, 2
,I don t get it Westbrook is averaging per game 18 1 PTS 7 6 REB 7 2 AST with his same career shooting avg of 43 So what gives BTW his FG is higher than Edwards Ball Stephen Curry Love Harden Conley Russell Van Fleet Randle Klay Barrett etc, 2
,I don t get it Westbrook is averaging per game 18 1 PTS 7 6 REB 7 2 AST with his same career shooting avg of 43 So what gives BTW his FG is higher than Edwards Ball Stephen Curry Love Harden Conley Russell Van Fleet Randle Klay Barrett etc, 2
,I don t get it Westbrook is averaging per game 18 1 PTS 7 6 REB 7 2 AST with his same career shooting avg of 43 So what gives BTW his FG is higher than Edwards Ball Stephen Curry Love Harden Conley Russell Van Fleet Randle Klay Barrett etc, 2
,I don t get it Westbrook is averaging per game 18 1 PTS 7 6 REB 7 2 AST with his same career shooting avg of 43 So what gives BTW his FG is higher than Edwards Ball Stephen Curry Love Harden Conley Russell Van Fleet Randle Klay Barrett etc, 2
,I don t get it Westbrook is averaging per game 18 1 PTS 7 6 REB 7 2 AST with his same career shooting avg of 43 So what gives BTW his FG is higher than Edwards Ball Stephen Curry Love Harden Conley Russell Van Fleet Randle Klay Barrett etc, 2
,I don t get it Westbrook is averaging per game 18 1 PTS 7 6 REB 7 2 AST with his same career shooting avg of 43 So what gives BTW his FG is higher than Edwards Ball Stephen Curry Love Harden Conley Russell Van Fleet Randle Klay Barrett etc, 2
,I don t get it Westbrook is averaging per game 18 1 PTS 7 6 REB 7 2 AST with his same career shooting avg of 43 So what gives BTW his FG is higher than Edwards Ball Stephen Curry Love Harden Conley Russell Van Fleet Randle Klay Barrett etc, 2
,I don t get it Westbrook is averaging per game 18 1 PTS 7 6 REB 7 2 AST with his same career shooting avg of 43 So what gives BTW his FG is higher than Edwards Ball Stephen Curry Love Harden Conley Russell Van Fleet Randle Klay Barrett etc, 2
,I don t get it Westbrook is averaging per game 18 1 PTS 7 6 REB 7 2 AST with his same career shooting avg of 43 So what gives BTW his FG is higher than Edwards Ball Stephen Curry Love Harden Conley Russell Van Fleet Randle Klay Barrett etc, 2
