blah,tweet,score
,Ok Stephen Curry, 1
,NBA Fan Wonders Why A Fan Wore A Stephen Curry Jersey To Game 7 Of The 2013 NBA Finals This Man Was A Time Traveller NBA News, 1
,team with chris bosh shrek Carmelo Anthony stephen curry and justin riley, 2
,team with stephen curry Kevin love joakim noah Trey ebert and michael james, 2
,Irving better than stephen curry period, 0
,Stephen Curry 15 pts 5 rebs 5 asts vs Clippers 21 22 season, 2
,Stephen Curry, 2
,Stephen Curry can t stop laughing after break his own record, 1
,30 MINUTES of Stephen Curry s Greatest Warriors Buckets via, 1
,Most 25 point games in less than 30 minutes played across the last 5 seasons 1 Giannis Antetokounmpo 41 2 Stephen Curry 21 3 Joel Embiid 18, 1
,Playoff Projection Starter Stephen Curry Klay Thompson Andrew Wiggins Draymond Green Kevon Looney Bench 1st Rot Jordan Poole Gary Payton II Moses Moody Jonathan Kuminga James Wiseman 2nd Rot Andre Igoudala Damion Lee Otto Porter Jr Juan Tuscano Anderson Nemanja Bjelica, 2
,2 straight made in 3 call me Stephen Curry, 1
,STEPHEN CURRY 12 SHOTS TAKEN, 2
,NBA Quand Ja Morant se prend pour Stephen Curry NBAextra, 2
,team with Dwight Howard stewie stephen curry max burton and jason Voorhes, 2
,Most recent stat lines from Russell Westbrook Reggie Jackson Stephen Curry amp Klay Thompson, 2
,Another milestone for Stephen Curry Most Steals in Franchise History, 1
,Post Edited Stephen Curry with an assist vs the LA Clippers, 2
,Wardell Stephen Curry II, 2
,Predicting Top 10 Playoff Performers for the Next 3 Years 1 Kawhi Leonard ring FMVP 2 Stephen Curry ring FMVP 3 Kevin Durant 4 Nikola Jokic 5 Giannis Antetokounmpo ring FMVP 6 Luka Doncic 7 LeBron James 8 Donovan Mitchell 9 Jayson Tatum 10 Joel Embiid, 1
,Jackie Moon aka Will Ferrell x Klay amp Stephen Curry pregame workout before Warriors vs Clippers, 2
,team with Dwight Howard stephen curry Russell westbrook Trey ebert and homer, 2
,Warriors Stephen Curry sounds pretty happy about going back to his old rotation and he talks about how that benefits the team DubNation LACvsGSW, 2
,For example Klay Thompson who typically only has the ball in his hands when he s taking a shot or swinging it has a usage rate of 28 6 while Steph has a usage of 31 By your logic Klay handles the ball and generates offense at nearly the same level as Stephen Curry, 2
,This should be the Warriors starting lineup 1 Stephen Curry 2 Jordan Poole 3 Klay Thompson 4 Jonathan Kuminga 5 Kevon Looney, 2
,Fuckkkkkkk youuuu Stephen curry, 0
,Stephen Curry said he was shocked by the energy of Will Ferrell during tonight s pregame warm ups Also adds the 2 ball drill isn t for everyone Question via DubNation NBA75, 2
,Something different Ronbo Warriors win tonight Jackie Moon Will Ferrell Trolls Stephen Curry and Dances with Klay Thompson Warriors via, 2
,Stephen Curry said Jackie Moon gave the team a pep talk before the game and set the vibe to begin the night, 1
,Stephen Curry shrugged and smiled about Will Ferrell trying the two time MVP s dribbling drill The two ball It s not for everybody, 2
,Listen I have nothing but respect for the only player born in Akron to win two NBA championships in Cleveland That means something His name is Wardell Stephen Curry II and he has a habit of dickslapping Lebron in the Finals bozo, 1
,adotsdot The reason is called Stephen Curry just look at 2019 20, 2
,Chris Chiozza look s like a Stephen Curry doppelganger I had to look at my TV bout 4 different time s to make sure I was looking correctly LACvsGSW NBAonTNT, 1
,Cole Anthony vs Stephen Curry Stats, 2
,The Warriors could be looking for some backcourt help and they have turned their attention to former Rookie of the Year winner Tyreke Evans, 2
,The Warriors could be looking for some backcourt help and they have turned their attention to former Rookie of the Year winner Tyreke Evans, 2
,Stephen Curry woke up feeling dangerous 15 PTS 5 12 FG 1 6 3PT 5 AST 4 turnovers MVP Top 10 player, 1
,I ve said it before I ll say it again This should be the Warriors starting lineup 1 Stephen Curry 2 Jordan Poole 3 Klay Thompson 4 Jonathan Kuminga 5 Kevon Looney, 2
,The stars were back in the lineup for the Warriors and the Dubs had their best defensive performance in some time Not to be outshined Jonathan Kuminga Moses Moody and Jordan Poole continued their recent stretch of quality play, 1
,I ve lost all hope for Stephen Curry, 0
,1 363 steals and counting Stephen Curry has surpassed Warriors legend Chris Mullin to become the all time steals leader in franchise history NBA75, 1
,Everything went right for the Warriors in a 112 97 victory over the Clippers, 1
,Stephen curry tonight 3 8 22 Min 35 Pts 15 Ast 5 Reb 5 Fg 5 12 3fg 1 6 Pf 4 Blk 0 Stl 3 Ft 4 4 To 4 6, 2
,Watch Ayesha Curry s Viral Invasion of Stephen Curry s Interview With Female Reporter had Caused a Sports Warriors DubNation NBAYoungboy NBAAllStar, 2
,Ugh I know Little does he know he s Stephen Curry, 1
,I need the NBA to investigate Stephen Curry to see if he s on fanduel immediately, 2
,The five game losing streak is over The Warriors 44 12 defeated the Clippers 34 33 112 97 Johnathan Kuminga led the Warriors scoring with 21 points Klay Thompson and Jordan Poole both had 20 points Stephen Curry had 15 points Andrew Wiggins with 14 points and 11 boards, 1
,RECORD UPDATE With his 15 points today Stephen Curry is now 28 points away from the 20 000 point club, 1
,Stephen Curry amp Klay Thompson every game CurFraud, 2
,Player Props Stephen Curry Three Pointers made over 3 5 Darius Bazley Points Assists and Rebounds Under 21 5, 2
,We might finally win a game or may not but don t let this WIN to distract us from the fact that Stephen Curry is our best player and we are NOT ABLE to create a single game where he is fed to play his best basketball and that s A PROBLEM, 0
,Stephen Curry amp Klay Thompson tonight, 2
,Police the woman can stop Stephen curry from using me But you all had 2c that in the, 2
,Analytics will say Stephen Curry struggle tonight and Andrew Wiggins had a good game, 0
,Team remains unbowed no matter what tho So I m not worried even though this was totally a winnable game even with Stephen Curry and Klay Thompson in the Warriors roster, 0
,Stephen Curry is a fucking disgrace to NBA Basketball, 0
,some of us had to sit and watch this lead vanish, 0
,Stephen Curry and Klay Thompson still in because Warriors haven t played well most of post All Star break and those guys didn t play last night in Denver, 2
,team with stephen curry Russell westbrook Tim duncan kobe bryant and kyrie irving, 2
,STEPHEN CURRY DEADLY FLOATER, 1
,Andrew Wiggins with 14 points for the Warriors Stephen Curry with 13 points 92 66 Warriors as they call a timeout, 2
,when stephen curry knew that he s not shooting very well he make plays for his teammates and not forcing to make shots, 1
,ARREMESSE STEPHEN CURRY, 2
,Stephen Curry should be the NBA logo, 1
,Q4 11 42 LAC 61 GSW 88 Stephen Curry 5 369 career assists needs 2 assists to tie Damon Stoudamire for 55th on the All Time assists list at 5 371 source NBA alerts, 2
,Pfft Not me I never forgot that they still have Stephen Curry and Klay Thompson, 1
,the 4th quarter will start Now can play Stephen curry the all 4th quarter, 2
,Golden State leads Clippers 86 61 And this is a night where a rested Stephen Curry has only 11 points and Klay Thompson has needed 19 shots to get his 16 points It s been Jordan Poole leading the way 20 points 8 12 FGs 4 5 3s Clippers bench 17 points 6 19 FGs 3 11 3s, 2
,Stephen curry sucks, 0
,Stephen Curry is the greatest offensive player in basketball history, 1
,We love Poole Moody Kuminga but if Curry and Klay don t find their stroke it won t be good come playoffs Kerr has to get his superstar star going and especially Curry Because guys are acting like he doesn t exist on the floor with him and he s STEPHEN CURRY LACvsGSW, 0
,it s going to be sad af when we have to use this meme for Stephen Curry, 0
,Stephen curry is ass, 0
,Stephen curry gt, 2
,Congratulations Stephen curry for passing Chris Mullin for most steals in franchise history Not just a splashbro dubnation, 1
,Stephen Curry, 2
,Stephen curry t minus 10 700 obo Connect sell Calendar, 2
,Kerr is trying make everyone brings the ball up the court even though they ve Stephen Curry I don t understand this man at all LACvsGSW, 1
,PUT STEPHEN CURRY PRA PLAY SEUS FILHO DA BITCH, 2
,Stephen Curry has passed Chris Mullin for most steals in Golden State Warriors franchise history 1 361, 2
,I need 8 points from Reggie Jackson 5 points from Terance Mann 4 points from Ivica Zubac 7 points from Stephen Curry 4 points from Amir Coffey 1 assist from Klay Thompson 1 rebound from Terance Mann Clippers need to pick it up FanDuel NBATwitter, 2
,5 Stephen Curry, 2
,HALFTIME Jordan Poole 13 pts Stephen Curry 11 pts Kevin Looney 7 pts, 2
,Stephen Curry has passed Chris Mullin for most steals in Warriors franchise history, 2
,Stephen Curry s last steal gives him 1 361 for his career It s the most in Warriors franchise history, 2
,Stephen Curry us now the all time steals leader in Warriors franchise history He s also the all time leader in Points Assists Games played 3s made Now Steals WOW, 2
,Stephen Curry joins Mike Conley Memphis LeBron James Cleveland and Reggie Miller Indiana as the only players to lead the franchise in career points assists 3 pointers steals and games played, 2
,Warriors have new career steals lesser Stephen Curry, 2
,Stephen Curry Golden State Warriors, 2
,I am back Stephen Curry, 1
,STEPHEN CURRY, 2
,Chron Congrats Goat Stephen curry, 2
,stephen curry has officially passing chris mullin for most career steal in franchise history 1 361, 2
,Stephen Curry is now the Warriors all time leader in steals with 1 361 Congrats, 2
,With his last steal Stephen Curry becomes the all time Golden State Warriors franchise leader in steals with 1 361, 2
,I have no friends I have no girlfriend I have no job I have no money I have no hobbies I have no home All I have is Stephen Curry When I needed something Stephen Curry was there for me Stephen Curry is my life my passion and my faith I love Steph Curry, 1
,This is THE Stephen Curry, 1
,STEPHEN CURRY WITH A THREE, 2
,Stephen Curry just became the Warriors career leader for steals with 1 361, 2
,WARDELL STEPHEN CURRY, 2
,SPLASH STEPHEN CURRY VAMO PORRA, 2
,PRIMER TRIPLE DE STEPHEN CURRY, 2
,STEPHEN CURRY 3, 2
,STEPHEN CURRY FOR THREE, 2
,stephen curry voltou, 2
,Stephen Curry just became the Warriors All Time leader in steals, 2
,STEPHEN CURRY FOR THREE, 2
,STEPHEN CURRY, 2
,Stephen Curry is now the Warriors all time leader in steals with 1 361, 2
,STEPHEN CURRY, 2
,Stephen Curry, 2
,STEPHEN CURRY, 2
,12 6 12 6 Stephen Curry is the greatest player of all time, 2
,STEPHEN CURRY, 2
,Stephen Curry for 3, 2
,Stephen Curry by the way is moving very well, 1
,Stephen Curry is a very unserious basketball player, 2
,Your header is a picture of Wardell Stephen Curry II Because of this I drew the conclusion that you are a fan of his I am as well he is amazing Was I wrong, 1
,Clippers and Warriors tied after 1 21 21 Nic Batum 8 pts 1 reb Marcus Morris 6 pts 2 rebs Ivica Zubac 2 pts 5 rebs 4 stls 1 blk Stephen Curry 6 pts 1 ast, 2
,Tonight s starters for the Warriors Stephen Curry Moses Moody Klay Thompson Andrew Wiggins Jackie Moon ez dubs, 2
,Clippers shot 26 Warriors 33 Nicolas Batum leads all scorers with 8 points Ivica Zubac only has 2 points but he does have 5 rebounds and 4 steals plus a block Stephen Curry leads Golden State with 6 points, 2
,Stephen Curry commits a turnover out of the double team bangs into Nic Batum while scuffling for the ball and comes up limping Comes out with 2 37 left in the first This after Warriors coach Steve Kerr says Steph likely to play full first third quarters, 2
,Points as of March 8th 2022 9 34 pm cst Stephen Curry 6 8, 2
,New rotation for Stephen Curry tonight, 2
,Give Moody the ball if your name is not Stephen Curry, 1
,Finals Lost Stephen curry 2 0 I m just the messenger, 2
,STEPHEN CURRY BASKET DE CALIDAD, 2
,STEPHEN CURRY, 2
,STEPHEN CURRY, 2
,We need stephen curry, 1
,Stephen Curry rest starting for Warriors on Tuesday Jordan Poole back to bench numberFire NBA DFS FanDuel, 2
,Stephen Curry honors his daughters Riley amp Ryan in the Girl Dad Curry 9 Flows on InternationalWomensDay, 2
,NBA Fans have been debating it all week Tyler Herro or Stephen Curry Who is better right now, 2
,Wardell Stephen Curry II plays basketball tonight, 2
,Stephen curry is currently the most overrated player in basketball He has regressed noticeably specifically in his isolation game He is an off ball screen merchant and at this point he is a glorified JJ Redick He will be exposed in, 0
,Stephen Curry is 43 points away from 20 000 career points do as that as you may, 2
,Your tweet was quoted in an article by hitfix, 2
,Your tweet was quoted in an article by hitfix, 2
,Your tweet was quoted in an article by hitfix, 2
,Your tweet was quoted in an article by hitfix, 2
,Your tweet was quoted in an article by hitfix, 2
,WillFerrell Dressed As Jackie Moon And Warmed Up With KlayThompson And Stephen Curry via, 2
,Worked on this x fan art while watching countless Stephen Curry s performance I hope would love this as I learned Steph Curry is his fav Webros, 2
,Nah It s PG Stephen Curry SG Moses Moody SF Klay Thompson PF Andrew Wiggins C Kevon Looney, 2
,How prophetic the title of your GQ article is THE SECOND COMING OF STEPHEN CURRY Like never seen before Wait for it, 1
,NBA Defensive GOAT STEPHEN CURRY AND KLAY THOMPSON WARMING UP TOGETHER WITH JACKIE MOON 227 s YouTube Chili Draymond Chili Green 9 3 PPG 8 7 RPG 7 0 APG DubNation Spicy, 1
,Perfect Draymond Green Replacement Stephen Curry and Klay Thompson cannot control their laughter after Will Ferrell takes over Pre Game warmup GoldenStateWarriors NBA, 2
,1U Stephen curry 24 5O Pts Like if tailing, 2
,NBA NBAPROPS Stephen Curry Over 5 5 assists Over 3 5 rebounds 114, 2
,Stephen Curry, 2
,gonna take a 10min nap amp wakeup cz Stephen Curry on today, 2
,Will Ferrell dressed as Jackie Moon and warmed up with Klay Thompson and Stephen Curry, 2
,What is you favorite Stephen Curry moment DubNation I ll start, 2
,Clippers starters Nicolas Batum Marcus Morris Sr Ivica Zubac Terance Mann Reggie Jackson Warriors Moses Moody Andrew Wiggins Kevon Looney Klay Thompson Stephen Curry, 2
,Tonight in SF LAC 34 32 Nicolas Batum Marcus Morris Sr Ivica Zubac Terance Mann Reggie Jackson GSW 43 22 Moses Moody Andrew Wiggins Kevon Looney Klay Thompson Stephen Curry, 2
,Starters LAC Nicolas Batum Marcus Morris Sr Ivica Zubac Terance Mann Reggie Jackson GSW Moses Moody Andrew Wiggins Kevon Looney Klay Thompson Stephen Curry, 2
,Stephen curry isn t more SKILLED then Irving yes he shoots better that s about it, 0
,STEPHEN CURRY RANGE, 1
,Hands down IT S STEPHEN CURRY, 2
,this game showed that Kyrie is truly better than Stephen Curry, 0
,Will Ferrell dressed as Jackie Moon got up shots with Klay Thompson amp Stephen Curry before tonight s Warriors game Ferrell s character is an inspiration to Klay Ferrell hit some shots too Via, 2
,Quinteto titular de esta noche Stephen Curry Moses Moody Klay Thompson Andrew Wiggins Kevon Looney, 2
,Smoking on that shit that cooked Stephen Curry, 0
,Stephen Curry Klay Thompson and Draymond Green are on the court with Jackie Moon, 2
,yes please tell stephen curry who raised this franchise from poverty to act injured or ask for a trade a month after the trade deadline lol, 0
,shamet em noite de stephen curry, 2
,WATERS FUME STEPHEN CURRY MAIS D UNE FORCE, 2
,Kyrie Irving when plays is better than Stephen Curry, 0
,The inside story of how LeBron James Stephen Curry and Gregg Popovich brought political activism to the NBA, 2
,Stephen Curry your legacy is on the line, 2
,can t wait for wardell stephen curry to score 15 fifteen points lol, 0
,Quinteto inicial confirmado 3 0 Stephen Curry 4 Moses Moody 1 1 Klay Thompson 2 2 Andrew Wiggins 5 Kevon Looney DubNation, 2
,stephen curry your legacy is on the line TONIGHT, 2
,team with Bill russell jared west stephen curry patrick and Anthony davis, 2
,Wardell Stephen Curry II is the goat, 1
,5 meant to be a savior or a part of a big three The media and the Lakers fan base are surprised now that at age 33 Russell Westbrook hasn t transitioned into becoming Stephen Curry for them It s so idiotic and whimsical that they expected this man to change his entire game, 0
,Stephen curry is 43 points away from hittin 20 000 career points, 2
,PTS props for Clippers Warriors tonight Where s the easy Stephen Curry O 24 5 125 U 24 5 105 Klay Thompson O 17 5 115 U 17 5 115 Andrew Wiggins O 15 5 115 U 15 5 115 Reggie Jackson O 19 5 110 U 19 5 120, 2
,Stephen curry, 2
,LIPIDS NFT EXPECT TO EARN FART WILHELM REICH EUDORA WELTY BITCOIN TUBA 7TH FLOOR UNTANGLE STARCRAFT RODENTS TECHNOLOGY STEPHEN CURRY PARALLEL SOLID LOBELIA VAGINA TO CLEAR TO FART MARTIAN DOGEZILLA CHINA IDIOT ZAP ISTANBUL ZOOEY DESCHANEL CHARLIE BROWN PAIN BALDNESS CANADA, 2
,Steven Curr his name is Stephen Curry GrandCrew, 2
,Why is Halliburton Stephen curry tonight, 1
,wyatt when steven coo ray got into the nba league and wanted to prove to everyone that he belonged there didn t he just dribble the ball extra hard sherm okay there s a lot of things wrong with what you just said but mainly his name is stephen curry, 2
,Golden State Warriors Starting Lineup 3 8 PG Stephen Curry SG Moses Moody SF Klay Thompson PF Andrew Wiggins C Kevon Looney, 2
,Golden State Warriors Starters Stephen Curry Moses Moody Klay Thompson Andrew Wiggins Kevon Looney Players out Draymond Green Andre Iguodala Gary Payton Otto Porter DubNation NBA NBATwitter NBA75, 2
,Warriors 03 08 22 NBA Confirmed Lineup Kevon Looney C Andrew Wiggins PF Klay Thompson SF Moses Moody SG Stephen Curry PG, 2
,GOLDEN STATE WARRIORS CONFIRMADO PARA LOGO MAIS Stephen Curry Moses Moody Klay Thompson Andrew Wiggins e Kevon Looney Pra cima DubNation, 2
,Stephen Curry Klay Wiggins back in starting five, 2
,5 Inicial Stephen Curry Klay Thompson Moses Moody Andrew Wiggins Kevon Looney DubNation, 2
,UPDATE NBA NBA75 Game LAC vs GSW WARRIORS Starters Confirmed PG Stephen Curry SG Moses Moody SF Klay Thompson PF A Wiggins C Kevon Looney SBPStarters for all other games ClipperNation DubNation NBATwitter GamblingTwitter, 2
,UPDATE NBA NBA75 Starting Lineup LAC vs GSW CLIPPERS Expected PG R Jackson SG Terance Mann SF Marcus Morris PF Nicolas Batum C Ivica Zubac WARRIORS Confirmed PG Stephen Curry SG Moses Moody SF Klay Thompson PF A Wiggins C Kevon Looney NBATwitter GamblingTwitter, 2
,Stephen Curry, 2
,Quinteto inicial confirmado 3 0 Stephen Curry 4 Moses Moody 1 1 Klay Thompson 2 2 Andrew Wiggins 5 Kevon Looney DubNation, 2
,QUINTETO INICIAL DE WARRIORS vs Clippers Stephen Curry Moses Moody Klay Thompson Andrew Wiggins Kevon Looney, 2
,How is it Jordan played plumbers In Jordan LeBron Debates but never in Magic Johnson or Stephen Curry or KD or Bird debates, 2
,I calmly predict stephen curry making 45 points and the golde state losing by 10 to clippers, 0
,klaynation How does my initial point make no sense There are impact stats that show that he was a historical net negative while playing alongside Stephen Curry and Draymond Green, 0
,Warriors starters tonight vs the Clippers Stephen Curry Moses Moody Klay Thompson Andrew Wiggins Kevon Looney, 2
,TONIGHT S STARTERS vs LAC Stephen Curry Moses Moody Klay Thompson Andrew Wiggins Kevon Looney, 2
,Stephen Curry lost 1 social credit, 0
,Wardell Stephen Curry ll, 2
,Who is LeBron Someone who forms superteams 6 Finals Losses Stephen Curry s son Owned By Kawhi and KD Never will be the goat Chokes under pressure Can t carry a team, 0
,Stephen curry, 2
,This iggy podcast is great, 1
,Stephen curry type stats, 2
,Ja Morant gt Stephen Curry, 2
,Stephen curry, 2
,Stephen Curry Is a great guy who is very talented, 1
,Starting lineup for tonight PG Stephen Curry SG Klay Thompson SF Andrew Wiggins PF Otto Porter Jr C Kevon Looney dubnation splashbros, 2
,28 min mark till the end is STEPH, 2
,LOVING THE LOOK OF THESE PROPS Nicolas Batum U 7 points Stephen Curry O 21 points Reggie Jackson O 4 5 rebounds LETS WIN BIG WITH TACO TUESDAY PRIZEPICKS, 2
,Stephen Curry to score 40 points nameabet, 2
,stephen curry is okay, 2
,2009 10 Prestige Stephen Curry Rook whodoyoucollect, 2
,team with Trey ebert homer david west stephen curry and puss n boots, 2
,Legend Stephen Curry as Midorima, 2
,Stephen curry should be fresh tonight hes hit 33 33 45 pts in 3 matchups vs clippers this season Curry Ov 25 5 pts, 2
,bruh i got doja cat AND stephen curry under my tweet, 2
,Player Props Stephen Curry Three Pointers made over 3 5 Darius Bazley Points Assists and Rebounds Under 21 5, 2
,Stephen Curry Autograph Jersey autograph, 2
,Moody got some dawgs on our side we got the vets Draymond amp Stephen Curry testing us b4 the game, 2
,klaynation How dare people expect the second overall pick to not be a historically negative player next to Stephen Curry and Draymond Green, 0
,Stephen Curry is also on pace to be the first player in the NBA to be part of the 20 000 point club with 3 000 made threes, 1
,1u Stephen Curry GSW OVER 24 5 Points 120 the Warriors are on a 5 game losing streak desperate for a W here and w Klay and Wiggins struggling I expect him to take over here scored 45 33 33 vs LAC this year over in L5 7 great spot amp matchup PlayerProps, 0
,org I calmly predict stephen curry making 45 points and the golde state losing by 10 to clippers, 0
,if you a dubs fan listen to this go to 28 min that s where STEPH starts speaking, 2
,On InternationalWomensDay listen, 2
,Check out this listing I just found on Poshmark Golden State Warriors 30 Stephen Curry shopmycloset, 2
,11 Dirk Nowitzki 12 LeBron James 13 LeBron James 14 LeBron James 15 Stephen Curry 16 LeBron James 17 Kevin Durant 18 LeBron James 19 Kawhi Leonard 20 Anthony Davis 21 Giannis Antetokounmpo 22 TBD, 2
,will be the Kevin Durant to your Stephen Curry, 2
,Apostas Just go with Stephen Curry over 24 5 points He s always going crazy against the Clippers, 2
,NBA Defensive GOAT Golden State Warriors Positives amp Negatives Including Stephen Curry s Rotation amp 227 s YouTube Chili Draymond Chili Green 9 3 PPG 8 7 RPG 7 0 APG DubNation Spicy, 2
,Injury Updates PG Stephen Curry hand SG SF Klay Thompson rest and SF PF Andrew Wiggins foot are active tonight SF Lu Dortz left shoulder strain will miss the raminder of the regular season SG Lance Stepenson left ankle sprain is a late scratch tonight NBA75, 2
,stephen curry is a worse analyst than the GOAT hp editz, 0
,A Western Conference doubleheader begins on tonight starting at 7 30 p m ET Lock in to see Brandon Ingram Ja Morant Reggie Jackson amp Stephen Curry in action, 2
,FYI Stephen Curry is 43 points away from the 20 000 point club, 2
,NBA Leader 25 5 PPG NBA CRAZY REACTIONS to 227 s YouTube Chili Nikola Chili Joki 25 5 PPG 14 0 RPG 7 0 APG MileHighBasketball Spicy 75TH TRIPLE DOUBLE in WIN VS STEPHEN CURRY, 2
,Stephen curry is here, 2
,5 2 stephen curry arguably the worst one out of this list had a better year than both of them, 2
,Check out this product WM444 Stephen Curry Famous Minifigures by RELXELF ACG Hub starting at 4 90 Show now, 2
,anyone who didn t know my birthday is on March 14th just like Stephen Curry Birthday is the same as mines lol, 2
,Stephen Curry, 2
,BETTER shooter BUT Actually Stephen Curry has more misses than Reggie Miller sooooo, 0
,No it doesn t because Stephen Curry is 3rd Stephen Curry also goes 9 40 6 28 etc throughout his career No one says nothing Carry on, 2
,Well Stephen Curry is 3rd soooooo that DIDN T matter do it, 2
,Stephen curry is the best in all the world, 1
,Stephen Curry is Stephen Colbert, 2
,Highly recommended, 2
,Type Stephen Curry is, 2
,Stephen Curry NBA Bitcoin F 16 McDonalds, 2
,Record time Stephen Curry is 43 points away from the 20 000 point club, 2
,andrews Way to stand by the MVP candidate Stephen Curry who has single handedly carried your coaching career Steve, 1
,Smt Stephen Curry is 53 on the All time scoring list with 19 957, 2
,Yes own it Because gender pay gaps are real and a real problem that employers need to face not hide from Fair play to, 2
,I feel like Stephen Curry, 1
,Xam s Props Ja Morant Over 1 5 Made 3s 138 Stephen Curry Over 6 5 Assists 120 Reggie Jackson Under 2 5 Made 3s 132 Let s make it another positive Prop betting night GamblingTwitter, 2
,Congratulations to the Mr Lebron James and Mr Stephen Curry who exemplified love and respect for the game throughout the All Star Event Thank you Gentlemen Bless you, 1
,NBA75 NBAPicks LA Clippers GS Warriors Stephen Curry OVER 24 5 Points 1 90 bet365 1u, 2
,Stephen Curry rest active Tuesday via sells fantasybasketball, 2
,In other words Stephen curry made 179 more than Britney griner, 2
,March 8 2015 Stephen Curry with some wizard shit before stepping back and draining the three against the Clippers, 2
,NBA Fantasy Projection Updates Juan Toscano Anderson 5 1 pts gt 11 8 pts Nemanja Bjelica 13 4 pts gt 18 6 pts Stephen Curry 48 4 pts gt 43 6 pts Moses Moody 9 5 pts gt 12 9 pts Andrew Wiggins 33 9 pts gt 30 6 pts, 2
,It was inspirational to hear Dame Vivian Hunt deliver the Joan Woodward lecture this evening on the importance on gender equality She s so impressive it needed 3 people to introduce her, 2
,NBA Fantasy Projection Updates Otto Porter 19 8 pts gt 0 0 pts Gary Payton 14 6 pts gt 0 0 pts Jonathan Kuminga 16 2 pts gt 26 8 pts Stephen Curry 43 4 pts gt 48 4 pts Kevon Looney 27 7 pts gt 31 6 pts, 2
,stephen curry is 43 points away from 20 000 career points he ll get there tonight vs the clippers, 2
,Let s go Stephen curry, 1
,Stephen Curry Not listed on injury report, 2
,Stephen Curry Not listed on injury report, 2
,Here are my picks for today including the daily flex 5 Be on the lookout for Stephen Curry prop Good luck everybody PrizePicks PropBets NBA, 2
