blah,tweet,score
,I don t get it Westbrook is averaging per game 18 1 PTS 7 6 REB 7 2 AST with his same career shooting avg of 43 So what gives BTW his FG is higher than Edwards Ball Stephen Curry Love Harden Conley Russell Van Fleet Randle Klay Barrett etc, 2
,I don t get it Westbrook is averaging per game 18 1 PTS 7 6 REB 7 2 AST with his same career shooting avg of 43 So what gives BTW his FG is higher than Edwards Ball Stephen Curry Love Harden Conley Russell Van Fleet Randle Klay Barrett etc, 2
,I don t get it Westbrook is averaging per game 18 1 PTS 7 6 REB 7 2 AST with his same career shooting avg of 43 So what gives BTW his FG is higher than Edwards Ball Stephen Curry Love Harden Conley Russell Van Fleet Randle Klay Barrett etc, 2
,I don t get it Westbrook is averaging per game 18 1 PTS 7 6 REB 7 2 AST with his same career shooting avg of 43 So what gives BTW his FG is higher than Edwards Ball Stephen Curry Love Harden Conley Russell Van Fleet Randle Klay Barrett etc, 2
,Universal I don t get it Westbrook is averaging per game 18 1 PTS 7 6 REB 7 2 AST with his same career shooting avg of 43 So what gives BTW his FG is higher than Edwards Ball Stephen Curry Love Harden Conley Russell Van Fleet Randle Klay Barrett etc, 2
,Preview Warriors meet Clippers on second night of a back to back No rest for the weary, 2
,These are the ONLY superstars in the NBA right now Kevin Durant Stephen Curry LeBron James Joel Embiid Nikola Jokic Giannis Antetokounmpo Luka Doncic James Harden That s it, 2
,Stephen Curry did not suit up with the Golden State Warriors on their road game against the Denver Nuggets for him to take a rest HoopSnoop Fastbreak, 2
,Crying Stephen Curry fan who missed Warriors star gets tickets for Dubs next game in Denver, 0
,Julius Randle is the dark skin Stephen Curry, 0
,3 Nigga said trae young is better than Ja morant and Stephen curry you gotta be on crack, 0
,These are the ONLY superstars in the NBA right now Kevin Durant NBA Champ Stephen Curry NBA Champ LeBron James NBA Champ Joel Embiid None Nikola Jokic None G Antetokounmpo NBA Champ Luka Doncic NBA Champ Kawhi Leonard None That s it, 2
,Julius Randle surpassed Stephen Curry all time tonight, 0
,Own aint the word bud Stephen Curry has averaged 38 8 points 7 8 assists and 7 0 rebounds in 4 games versus Ja Morant in his career AND THEY 2 2, 2
,Warriors future is bright Stephen Curry 7 more years Jordan Poole Moses Moody Klay Thompson 9 more years Draymond Green 10 more years Jonathan Kuminga James Wiseman STEVE KERR is just 56 yrs old, 1
,I m sorry But if you factor in personality Stephen Curry is the best basketball player the the NBA S EVER SEEN, 1
,I can t get bitches so I defend Stephen curry, 0
,JUST IN Knicks outclass Kings 131 115 Nuggets take down Warriors 131 124 Randle Jokic Stephen Curry Poole NewYork NewYorkForever Sacramento Denver7 Oakland California, 2
,Nikola Jokic s triple double on back to back nights led Nuggets past Warriors without Stephen Curry Bet now via, 2
,Stephen Curry Signed Warriors Jersey in Custom LED Frame, 2
,Despite a valiant effort from their reserves with Stephen Curry Klay Thompson Andrew Wiggins and others out the Warriors season worst losing streak extended to five games, 2